[
  {
    "id": "lodging_tokyo_hostel",
    "label": "Dorm bed / capsule, Tokyo",
    "cityId": "tokyo",
    "category": "lodging",
    "tier": "hostel",
    "basis": "per_person_per_night",
    "low": 2500,
    "expected": 3500,
    "high": 5000,
    "asOf": "2026-07-31",
    "source": "https://www.hostelworld.com",
    "confidence": "low",
    "notes": "Unverified aggregate anchor. Verify before relying on it for a real budget."
  },
  {
    "id": "lodging_tokyo_business",
    "label": "Business hotel (APA / Toyoko Inn / Dormy Inn), Tokyo",
    "cityId": "tokyo",
    "category": "lodging",
    "tier": "business",
    "basis": "per_room_per_night",
    "low": 9000,
    "expected": 13000,
    "high": 18000,
    "asOf": "2026-07-31",
    "source": "https://www.booking.com",
    "confidence": "low"
  },
  {
    "id": "lodging_tokyo_midrange",
    "label": "3-4 star Western or boutique, Tokyo",
    "cityId": "tokyo",
    "category": "lodging",
    "tier": "midrange",
    "basis": "per_room_per_night",
    "low": 18000,
    "expected": 25000,
    "high": 35000,
    "asOf": "2026-07-31",
    "source": "https://www.booking.com",
    "confidence": "low"
  },
  {
    "id": "lodging_tokyo_upscale",
    "label": "4-5 star international brand or ryokan, Tokyo",
    "cityId": "tokyo",
    "category": "lodging",
    "tier": "upscale",
    "basis": "per_room_per_night",
    "low": 35000,
    "expected": 50000,
    "high": 75000,
    "asOf": "2026-07-31",
    "source": "https://www.booking.com",
    "confidence": "low"
  },
  {
    "id": "lodging_tokyo_luxury",
    "label": "Aman / Park Hyatt tier, Tokyo",
    "cityId": "tokyo",
    "category": "lodging",
    "tier": "luxury",
    "basis": "per_room_per_night",
    "low": 80000,
    "expected": 130000,
    "high": 220000,
    "asOf": "2026-07-31",
    "source": "https://www.booking.com",
    "confidence": "low"
  },
  {
    "id": "lodging_tokyo_ryokan_hanmeshi",
    "label": "Ryokan with dinner + breakfast, Tokyo",
    "cityId": "tokyo",
    "category": "lodging",
    "tier": "ryokan_hanmeshi",
    "basis": "per_person_per_night",
    "low": 25000,
    "expected": 35000,
    "high": 55000,
    "asOf": "2026-07-31",
    "source": "https://www.jalan.net",
    "confidence": "low",
    "notes": "When selected, engine must zero this leg's dinner and breakfast food cost."
  },
  {
    "id": "lodging_kyoto_hostel",
    "label": "Dorm bed / capsule, Kyoto",
    "cityId": "kyoto",
    "category": "lodging",
    "tier": "hostel",
    "basis": "per_person_per_night",
    "low": 2800,
    "expected": 3800,
    "high": 5500,
    "asOf": "2026-07-31",
    "source": "https://www.hostelworld.com",
    "confidence": "low"
  },
  {
    "id": "lodging_kyoto_business",
    "label": "Business hotel, Kyoto",
    "cityId": "kyoto",
    "category": "lodging",
    "tier": "business",
    "basis": "per_room_per_night",
    "low": 10000,
    "expected": 14000,
    "high": 19000,
    "asOf": "2026-07-31",
    "source": "https://www.booking.com",
    "confidence": "low"
  },
  {
    "id": "lodging_kyoto_midrange",
    "label": "3-4 star Western or boutique, Kyoto",
    "cityId": "kyoto",
    "category": "lodging",
    "tier": "midrange",
    "basis": "per_room_per_night",
    "low": 20000,
    "expected": 28000,
    "high": 40000,
    "asOf": "2026-07-31",
    "source": "https://www.booking.com",
    "confidence": "low"
  },
  {
    "id": "lodging_kyoto_upscale",
    "label": "4-5 star international brand or well-regarded ryokan, Kyoto",
    "cityId": "kyoto",
    "category": "lodging",
    "tier": "upscale",
    "basis": "per_room_per_night",
    "low": 40000,
    "expected": 58000,
    "high": 85000,
    "asOf": "2026-07-31",
    "source": "https://www.booking.com",
    "confidence": "low",
    "notes": "Watch the ¥100,000/person/night Kyoto lodging-tax bracket edge (taxes.json)."
  },
  {
    "id": "lodging_kyoto_luxury",
    "label": "High-end kaiseki ryokan / international luxury brand, Kyoto",
    "cityId": "kyoto",
    "category": "lodging",
    "tier": "luxury",
    "basis": "per_room_per_night",
    "low": 90000,
    "expected": 150000,
    "high": 280000,
    "asOf": "2026-07-31",
    "source": "https://www.booking.com",
    "confidence": "low",
    "notes": "Frequently crosses the Kyoto ¥100,000/person/night tax cliff (+¥10,000/person/night)."
  },
  {
    "id": "lodging_kyoto_ryokan_hanmeshi",
    "label": "Ryokan with dinner + breakfast, Kyoto",
    "cityId": "kyoto",
    "category": "lodging",
    "tier": "ryokan_hanmeshi",
    "basis": "per_person_per_night",
    "low": 30000,
    "expected": 45000,
    "high": 70000,
    "asOf": "2026-07-31",
    "source": "https://www.jalan.net",
    "confidence": "low",
    "notes": "When selected, engine must zero this leg's dinner and breakfast food cost."
  },
  {
    "id": "lodging_osaka_hostel",
    "label": "Dorm bed / capsule, Osaka",
    "cityId": "osaka",
    "category": "lodging",
    "tier": "hostel",
    "basis": "per_person_per_night",
    "low": 2200,
    "expected": 3000,
    "high": 4500,
    "asOf": "2026-07-31",
    "source": "https://www.hostelworld.com",
    "confidence": "low"
  },
  {
    "id": "lodging_osaka_business",
    "label": "Business hotel, Osaka",
    "cityId": "osaka",
    "category": "lodging",
    "tier": "business",
    "basis": "per_room_per_night",
    "low": 8000,
    "expected": 11000,
    "high": 15000,
    "asOf": "2026-07-31",
    "source": "https://www.booking.com",
    "confidence": "low"
  },
  {
    "id": "lodging_osaka_midrange",
    "label": "3-4 star Western or boutique, Osaka",
    "cityId": "osaka",
    "category": "lodging",
    "tier": "midrange",
    "basis": "per_room_per_night",
    "low": 15000,
    "expected": 21000,
    "high": 30000,
    "asOf": "2026-07-31",
    "source": "https://www.booking.com",
    "confidence": "low"
  },
  {
    "id": "lodging_osaka_upscale",
    "label": "4-5 star international brand, Osaka",
    "cityId": "osaka",
    "category": "lodging",
    "tier": "upscale",
    "basis": "per_room_per_night",
    "low": 30000,
    "expected": 42000,
    "high": 60000,
    "asOf": "2026-07-31",
    "source": "https://www.booking.com",
    "confidence": "low"
  },
  {
    "id": "lodging_osaka_luxury",
    "label": "Luxury international brand, Osaka",
    "cityId": "osaka",
    "category": "lodging",
    "tier": "luxury",
    "basis": "per_room_per_night",
    "low": 70000,
    "expected": 100000,
    "high": 170000,
    "asOf": "2026-07-31",
    "source": "https://www.booking.com",
    "confidence": "low"
  },
  {
    "id": "lodging_osaka_ryokan_hanmeshi",
    "label": "Ryokan with dinner + breakfast, Osaka",
    "cityId": "osaka",
    "category": "lodging",
    "tier": "ryokan_hanmeshi",
    "basis": "per_person_per_night",
    "low": 25000,
    "expected": 35000,
    "high": 55000,
    "asOf": "2026-07-31",
    "source": "https://www.jalan.net",
    "confidence": "low",
    "notes": "When selected, engine must zero this leg's dinner and breakfast food cost."
  },
  {
    "id": "lodging_hakone_hostel",
    "label": "Dorm bed / guesthouse, Hakone",
    "cityId": "hakone",
    "category": "lodging",
    "tier": "hostel",
    "basis": "per_person_per_night",
    "low": 3000,
    "expected": 4000,
    "high": 6000,
    "asOf": "2026-07-31",
    "source": "https://www.hostelworld.com",
    "confidence": "low"
  },
  {
    "id": "lodging_hakone_business",
    "label": "Small hotel / pension, Hakone",
    "cityId": "hakone",
    "category": "lodging",
    "tier": "business",
    "basis": "per_room_per_night",
    "low": 12000,
    "expected": 16000,
    "high": 22000,
    "asOf": "2026-07-31",
    "source": "https://www.booking.com",
    "confidence": "low"
  },
  {
    "id": "lodging_hakone_midrange",
    "label": "3-4 star resort hotel, Hakone",
    "cityId": "hakone",
    "category": "lodging",
    "tier": "midrange",
    "basis": "per_room_per_night",
    "low": 20000,
    "expected": 28000,
    "high": 38000,
    "asOf": "2026-07-31",
    "source": "https://www.booking.com",
    "confidence": "low"
  },
  {
    "id": "lodging_hakone_upscale",
    "label": "Upscale onsen ryokan, Hakone",
    "cityId": "hakone",
    "category": "lodging",
    "tier": "upscale",
    "basis": "per_room_per_night",
    "low": 35000,
    "expected": 50000,
    "high": 75000,
    "asOf": "2026-07-31",
    "source": "https://www.booking.com",
    "confidence": "low"
  },
  {
    "id": "lodging_hakone_luxury",
    "label": "Luxury onsen ryokan, Hakone",
    "cityId": "hakone",
    "category": "lodging",
    "tier": "luxury",
    "basis": "per_room_per_night",
    "low": 70000,
    "expected": 110000,
    "high": 180000,
    "asOf": "2026-07-31",
    "source": "https://www.booking.com",
    "confidence": "low"
  },
  {
    "id": "lodging_hakone_ryokan_hanmeshi",
    "label": "Ryokan with dinner + breakfast, Hakone",
    "cityId": "hakone",
    "category": "lodging",
    "tier": "ryokan_hanmeshi",
    "basis": "per_person_per_night",
    "low": 28000,
    "expected": 40000,
    "high": 65000,
    "asOf": "2026-07-31",
    "source": "https://www.jalan.net",
    "confidence": "low",
    "notes": "When selected, engine must zero this leg's dinner and breakfast food cost."
  },
  {
    "id": "lodging_nara_hostel",
    "label": "Dorm bed / guesthouse, Nara",
    "cityId": "nara",
    "category": "lodging",
    "tier": "hostel",
    "basis": "per_person_per_night",
    "low": 2500,
    "expected": 3200,
    "high": 4500,
    "asOf": "2026-07-31",
    "source": "https://www.hostelworld.com",
    "confidence": "low"
  },
  {
    "id": "lodging_nara_business",
    "label": "Business hotel, Nara",
    "cityId": "nara",
    "category": "lodging",
    "tier": "business",
    "basis": "per_room_per_night",
    "low": 8000,
    "expected": 10500,
    "high": 14000,
    "asOf": "2026-07-31",
    "source": "https://www.booking.com",
    "confidence": "low"
  },
  {
    "id": "lodging_nara_midrange",